Rank,Name,Platform,Publisher,Developer,VGChartz Score,Critic Score,User Score,Total Shipped,Sales NA,Sales PAL,Sales JP,Sales Other,Sales Global,Release Date,Last Update,Genre,Developers
91,Dark Souls,Series,Bandai Namco Entertainment,From Software,,,,37.33m,,,,,,04th Oct 11,22nd Oct 22,Role-Playing,From Software
92,PLAYERUNKNOWN'S BATTLEGROUNDS,PC,PUBG Corporation,PUBG Corporation,,,,36.60m,,,,,,21st Dec 17,29th Apr 19,Shooter,PUBG Corporation
93,Kingdom Hearts,Series,Square Enix,Square,,,,36.00m,,,,,,17th Sep 02,27th Feb 20,Role-Playing,"Square, Square Enix, Jupiter, h.a.n.d., BitGroove Inc., Success"
94,Tom Clancy's Rainbow Six,Series,Ubisoft,Ubisoft,,,,36.00m,,,,,,21st Aug 98,10th Feb 20,Shooter,"Ubisoft, Red Storm Entertainment"
95,Super Smash Bros. UltimateRead the review,NS,Nintendo,Bandai Namco Games,9.0,9.4,9.7,35.88m,,,,,,07th Dec 18,02nd Oct 22,Fighting,Bandai Namco Games
